Title,Link,Publication Date
A Good Hill to Die On // You’re Buying Into It?,https://pittnews.com/article/194071/blogs/a-good-hill-to-die-on-youre-buying-into-it/,"Tue, 04 Feb 2025 23:28:40 +0000"
"Do You Not Get the Concept? // Buckle up, cowboys!",https://pittnews.com/article/194069/blogs/do-you-not-get-the-concept-buckle-up-cowboys/,"Tue, 04 Feb 2025 23:27:01 +0000"
Your guide to the 2025 Student Government Board elections,https://pittnews.com/article/194066/top-stories/your-guide-to-the-2025-student-government-board-elections/,"Tue, 04 Feb 2025 15:33:18 +0000"
Emeritus Board of Trustees member settles civil suit against Board,https://pittnews.com/article/194062/top-stories/emeritus-board-of-trustees-member-settles-civil-suit-against-board/,"Tue, 04 Feb 2025 14:47:41 +0000"
Rochester faculty appointed to named professorships,https://www.rochester.edu/newscenter/rochester-named-professorships-july-december-2024-639042/,"Thu, 06 Feb 2025 16:22:36 +0000"
How does the atmosphere affect ocean weather?,https://www.rochester.edu/newscenter/how-does-the-atmosphere-affect-ocean-weather-638682/,"Fri, 31 Jan 2025 19:31:07 +0000"
January 2025 in Photos,https://www.rochester.edu/newscenter/january-2025-in-photos-638482/,"Fri, 31 Jan 2025 16:03:22 +0000"
Rochester’s Kevin Righter kept NASA space rocks free from contamination,https://www.rochester.edu/newscenter/nasa-bennu-asteroid-space-rocks-dust-curation-637932/,"Thu, 30 Jan 2025 21:35:31 +0000"
Nicole Sampson named University of Rochester provost,https://www.rochester.edu/newscenter/nicole-sampson-named-university-provost-637892/,"Thu, 30 Jan 2025 21:30:14 +0000"
"The truth may hurt. But for couples, it’s worth it.",https://www.rochester.edu/newscenter/the-truth-may-hurt-but-for-couples-its-worth-it-638402/,"Thu, 30 Jan 2025 21:08:34 +0000"
Awards and honors recognize faculty accomplishments,https://www.rochester.edu/newscenter/january-2025-faculty-awards-accolades-637602/,"Wed, 29 Jan 2025 16:50:38 +0000"
Mark Buckley: Biomedical engineering as a passion worth sharing,https://www.rochester.edu/newscenter/mark-buckley-biomedical-engineering-passion-worth-sharing-636762/,"Mon, 27 Jan 2025 22:45:07 +0000"
"Loretta Ford, former School of Nursing dean who transformed the profession, dies at 104",https://www.rochester.edu/newscenter/loretta-ford-former-school-of-nursing-dean-tribute-637022/,"Thu, 23 Jan 2025 23:46:56 +0000"
UVA Health reports decline in overdose calls in 2024,https://news.virginia.edu/content/uva-health-reports-decline-overdose-calls-2024,"Thu, 06 Feb 2025 16:58:03 +0000"
Retired UVa professor Lou Bloomfield is still teaching us 'How Things Work',https://news.virginia.edu/content/retired-uva-professor-lou-bloomfield-still-teaching-us-how-things-work,"Thu, 06 Feb 2025 16:57:38 +0000"
"Aliens, sloths and silliness: Super Bowl ads offer laughs, celebs and surprises to win over viewers",https://news.virginia.edu/content/aliens-sloths-and-silliness-super-bowl-ads-offer-laughs-celebs-and-surprises-win-over,"Thu, 06 Feb 2025 16:56:23 +0000"
Jade Devriendt,https://news.virginia.edu/content/jade-devriendt,"Wed, 05 Feb 2025 21:57:16 +0000"
New Technology Advancing Heart Failure Treatment at UVA Health,https://news.virginia.edu/content/new-technology-advancing-heart-failure-treatment-uva-health,"Wed, 05 Feb 2025 19:15:07 +0000"
Study finds way to detect post-partum depression in women,https://news.virginia.edu/content/study-finds-way-detect-post-partum-depression-women,"Wed, 05 Feb 2025 19:14:29 +0000"
How Can Schools Get More Men to Be Teachers? Look to Nursing for What Works,https://news.virginia.edu/content/how-can-schools-get-more-men-be-teachers-look-nursing-what-works,"Wed, 05 Feb 2025 19:14:00 +0000"
House Ad A: G&G: $100 in Scholarships,https://news.virginia.edu/content/house-ad-gg-100-scholarships,"Tue, 04 Feb 2025 18:16:54 +0000"
Inline: LIC: Basketball Ad (UVA Bookstore),https://news.virginia.edu/content/inline-lic-basketball-ad-uva-bookstore,"Tue, 04 Feb 2025 18:10:02 +0000"
Inline: G&G: Tuition Covered,https://news.virginia.edu/content/inline-gg-tuition-covered,"Tue, 04 Feb 2025 18:02:56 +0000"
Whale poop contains iron that may have helped fertilize past oceans,https://www.washington.edu/news/2025/02/06/whale-poop-contains-iron-that-may-have-helped-fertilize-past-oceans/,"Thu, 06 Feb 2025 16:00:16 +0000"
Robert J. Jones named 34th president of the University of Washington,https://www.washington.edu/news/2025/02/03/34th-uw-president/,"Mon, 03 Feb 2025 20:31:28 +0000"
Grasshopper size changes suggest how to predict winners and losers under climate change,https://www.washington.edu/news/2025/02/03/grasshopper-size-changes-suggest-how-to-predict-winners-and-losers-under-climate-change/,"Mon, 03 Feb 2025 19:39:21 +0000"
Q&A: UW researchers are designing cancer therapeutics that can kill cancer cells and restore healthy tissue,https://www.washington.edu/news/2025/02/03/uw-researchers-designing-cancer-therapeutics-can-kill-cancer-cells-restore-healthy-tissue/,"Mon, 03 Feb 2025 17:28:27 +0000"
"Q&A: UW-led research identifies migration, housing quality as risk factors in earthquake deaths",https://www.washington.edu/news/2025/02/03/qa-uw-led-research-identifies-migration-housing-quality-as-risk-factors-in-earthquake-deaths/,"Mon, 03 Feb 2025 17:09:35 +0000"
Report: UW No. 7 in the world powering global innovation,https://www.washington.edu/news/2025/01/31/report-uw-no-7-in-the-world-powering-global-innovation/,"Fri, 31 Jan 2025 16:04:39 +0000"
Q&A: How rate of CO2 rise can affect a global ocean current,https://www.washington.edu/news/2025/01/27/qa-how-rate-of-co2-rise-can-affect-a-global-ocean-current/,"Mon, 27 Jan 2025 21:52:18 +0000"
ArtSci Roundup: February 2025,https://www.washington.edu/news/2025/01/23/artsci-roundup-february-2025/,"Thu, 23 Jan 2025 21:26:23 +0000"
Finalist Named for Savannah State University President,https://www.usg.edu/news/release/finalist_named_for_savannah_state_university_president,No Date
Dr. Johnny L. Evans Jr. Named President of the College of Coastal Georgia,https://www.usg.edu/news/release/dr_johnny_l_evans_jr_named_president_of_the_college_of_coastal_georgia,No Date
Board of Regents Elects New Chair and Vice Chair for 2025,https://www.usg.edu/news/release/board_of_regents_elects_new_chair_and_vice_chair_for_2025,No Date
University System of Georgia Enrollment Hits An All&#45;Time Record,https://www.usg.edu/news/release/university_system_of_georgia_enrollment_hits_an_all_time_record,No Date
University of West Georgia Presidential Search Committee Named,https://www.usg.edu/news/release/university_of_west_georgia_presidential_search_committee_named_2024,No Date
"USG Foundation Raises $1.85 Million, Honors Chick&#45;fil&#45;A’s Dan Cathy and Reveals $10 Million Partnership for Foster Youth",https://www.usg.edu/news/release/usg_foundation_raises_1.85_million_honors_chick_fil_as_dan_cathy_and_reveals_10_million_partnership_for_foster_youth,No Date
"University System of Georgia in FY2024 Awarded an All&#45;Time High of 76,571 Degrees",https://www.usg.edu/news/release/university_system_of_georgia_in_fy2024_awarded_an_all_time_high_of_76571_degrees,No Date
University System of Georgia’s Economic Impact Grows to $21.9 Billion as Graduates Earn $1.4 Million More with Their College Degrees,https://www.usg.edu/news/release/university_system_of_georgias_economic_impact_grows_to_21.9_billion_as_graduates_earn_1.4_million_more_with_their_college_degrees,No Date
Dr. Ashwani Monga Named Interim President of the University of West Georgia,https://www.usg.edu/news/release/dr_ashwani_monga_named_interim_president_of_the_university_of_west_georgia,No Date
Dr. Russell T. Keen Named President of Augusta University,https://www.usg.edu/news/release/dr_russell_t_keen_named_president_of_augusta_university,No Date
