Title,Link,Publication Date
A ‘Wicked’ good time,https://news.harvard.edu/gazette/story/2025/02/cynthia-erivo-celebrated-as-hasty-pudding-woman-of-the-year/,"Thu, 06 Feb 2025 19:07:23 +0000"
What prompts genetic adaptation? Ask a finch.,https://news.harvard.edu/gazette/story/2025/02/what-prompts-genetic-adaptation-ask-a-finch/,"Thu, 06 Feb 2025 15:30:00 +0000"
Danger ahead,https://news.harvard.edu/gazette/story/2025/02/2024-was-rough-year-for-geopolitics-heres-what-u-s-is-facing/,"Wed, 05 Feb 2025 18:58:57 +0000"
Landmark studies track source of Indo-European languages spoken by 40% of world,https://news.harvard.edu/gazette/story/2025/02/landmark-studies-track-source-of-indo-european-languages-spoken-by-40-of-world/,"Wed, 05 Feb 2025 16:18:24 +0000"
Turns out pandemic wasn’t only cause for student setbacks,https://news.harvard.edu/gazette/story/2025/02/turns-out-pandemic-wasnt-only-cause-for-student-setbacks/,"Tue, 04 Feb 2025 21:26:18 +0000"
"Edvard Munch prints, paintings gifted to Harvard Art Museums",https://news.harvard.edu/gazette/story/2025/02/edvard-munch-prints-paintings-gifted-to-harvard-art-museums/,"Tue, 04 Feb 2025 21:07:48 +0000"
‘We cannot let our past become our children’s future’,https://news.harvard.edu/gazette/story/2025/02/larry-bacow-represents-harvard-at-event-marking-80th-anniversary-of-auschwitz-liberation/,"Tue, 04 Feb 2025 17:46:12 +0000"
A family at School when home is far away,https://news.harvard.edu/gazette/story/2025/02/a-family-at-school-when-home-is-far-away/,"Mon, 03 Feb 2025 19:03:27 +0000"
An archaeological record that doubles as art,https://news.harvard.edu/gazette/story/2025/02/an-archaeological-record-that-doubles-as-art/,"Mon, 03 Feb 2025 17:44:13 +0000"
"Doing College with ball in one hand, bow in the other",https://news.harvard.edu/gazette/story/2025/02/doing-college-with-ball-in-one-hand-bow-in-the-other/,"Mon, 03 Feb 2025 14:13:48 +0000"
What a Hamm,https://news.harvard.edu/gazette/story/2025/02/jon-hamm-celebrated-as-hasty-puddings-man-of-the-year/,"Sun, 02 Feb 2025 21:16:38 +0000"
Why are so many novels set at Harvard?,https://news.harvard.edu/gazette/story/2025/01/why-are-so-many-novels-set-at-harvard/,"Fri, 31 Jan 2025 16:23:39 +0000"
"Different day, different diagnosis?",https://news.harvard.edu/gazette/story/2025/01/study-finds-spike-in-adhd-cases-on-halloween/,"Fri, 31 Jan 2025 15:07:15 +0000"
"From sending thank-you notes to touching your co-worker’s food, she’s ruled on it all",https://news.harvard.edu/gazette/story/2025/01/from-sending-thank-you-notes-to-social-faux-pas-shes-ruled-on-it-all/,"Thu, 30 Jan 2025 21:08:34 +0000"
Who’s softer on crime? Democrats or Republicans?,https://news.harvard.edu/gazette/story/2025/01/whos-softer-on-crime-democrats-or-republicans/,"Thu, 30 Jan 2025 18:56:30 +0000"
"Who can save us from social media? At this point, perhaps just us.",https://news.harvard.edu/gazette/story/2025/01/book-excerpt-from-superbloom-by-nicholas-carr/,"Wed, 29 Jan 2025 16:44:52 +0000"
More than kind of blue,https://news.harvard.edu/gazette/story/2025/01/imani-perry-on-lyrical-new-book-weaving-memoir-history/,"Wed, 29 Jan 2025 16:29:12 +0000"
Gambling problems are mushrooming. Panel says we need to act now.,https://news.harvard.edu/gazette/story/2025/01/online-gambling-is-on-the-rise-panel-says-we-need-to-act-now/,"Tue, 28 Jan 2025 22:28:19 +0000"
One way to save lives in jails,https://news.harvard.edu/gazette/story/2025/01/one-way-to-save-lives-in-jails/,"Tue, 28 Jan 2025 17:26:18 +0000"
The brain’s gatekeepers,https://news.harvard.edu/gazette/story/2025/01/immune-cells-found-that-safeguard-memory-formation-brain-health/,"Tue, 28 Jan 2025 16:18:34 +0000"
Need to boost population? Encourage dads to step up at home.,https://news.harvard.edu/gazette/story/2025/01/need-to-boost-population-encourage-dads-to-step-up-at-home/,"Mon, 27 Jan 2025 20:51:29 +0000"
How exactly does ketamine work? New research offers insight.,https://news.harvard.edu/gazette/story/2025/01/how-exactly-does-ketamine-work-new-research-offers-insight/,"Mon, 27 Jan 2025 17:05:22 +0000"
What makes a good teacher?,https://news.harvard.edu/gazette/story/2025/01/what-makes-a-good-teacher/,"Mon, 27 Jan 2025 17:03:05 +0000"
"Boston, Harvard announce affordable housing funding",https://news.harvard.edu/gazette/story/2025/01/boston-harvard-announce-affordable-housing-funding/,"Mon, 27 Jan 2025 14:00:00 +0000"
How to avoid really bad decisions. (Hint: One tip is just hit pause.),https://news.harvard.edu/gazette/story/2025/01/how-to-avoid-bad-decisions/,"Fri, 24 Jan 2025 19:03:37 +0000"
Harvard University Housing establishes new rents for 2025–2026,https://news.harvard.edu/gazette/story/2025/01/harvard-university-housing-establishes-new-rents-for-2025-2026/,"Fri, 24 Jan 2025 15:00:00 +0000"
IU Columbus professor awarded collaborative grant to advance AI-powered autism research,https://news.iu.edu/columbus/live/news/43596-iu-columbus-professor-awarded-collaborative-grant-to-a,"Thu, 06 Feb 2025 05:00:00 -0500"
Nurturing Northwest Indiana’s entrepreneurial spirit,https://news.iu.edu/northwest/live/news/43734-iu-northwest-business-academy-entrepreneur,"Thu, 06 Feb 2025 05:00:00 -0500"
IU Indianapolis students tackle NFL analytics challenge,https://blogs.iu.edu/shhsnews/before-the-super-bowl-the-big-data-bowl-iu-indianapolis-students-tackle-nfl-analytics-challenge/,"Thu, 06 Feb 2025 05:00:00 -0500"
Purchasing process changes going into effect,https://today.iu.edu/live/news/43713-purchasing-process-changes-going-into-effect,"Thu, 06 Feb 2025 05:00:00 -0500"
"Embracing every opportunity, Krista Blackburn finds her community and career path at IU Columbus",https://news.iu.edu/columbus/live/news/43606-embracing-every-opportunity-krista-blackburn-finds,"Wed, 05 Feb 2025 05:00:00 -0500"
From the Caribbean to East Africa: IU geologist Claudia Johnson facilitates student exploration through fieldwork,https://news.iu.edu/college/live/news/43618-from-the-caribbean-to-east-africa-iu-geologist,"Wed, 05 Feb 2025 05:00:00 -0500"
Caring IU East students produce guides to better living,https://news.iu.edu/east/live/news/43722-caring-iu-east-students-produce-guides-to-better,"Wed, 05 Feb 2025 05:00:00 -0500"
"IU Northwest’s Center for Urban and Regional Excellence’s course offerings for February, March 2025",https://news.iu.edu/northwest/live/news/43716-cure-courses-february-march-2025,"Wed, 05 Feb 2025 05:00:00 -0500"
IU earns ‘Seal of Prevention’ for its leadership in student safety and wellness,https://today.iu.edu/live/news/43711-iu-earns-seal-of-prevention-for-its-leadership-in,"Wed, 05 Feb 2025 05:00:00 -0500"
Students in nation’s first cybersecurity law program provide legal advice on evolving tech,https://news.iu.edu/live/news/43709-students-in-nations-first-cybersecurity-law,"Wed, 05 Feb 2025 05:00:00 -0500"
Dance Theatre of Harlem to lead weeklong statewide residency,https://www.iuauditorium.com/news/detail/dth-release,"Wed, 05 Feb 2025 05:00:00 -0500"
IRS increases retirement plan limits for 2025,https://today.iu.edu/live/news/43614-irs-increases-retirement-plan-limits-for-2025,"Wed, 05 Feb 2025 05:00:00 -0500"
Future college students to receive help filing financial aid at IU Northwest,https://news.iu.edu/northwest/live/news/43708-college-goal-sunday-february-23,"Tue, 04 Feb 2025 05:00:00 -0500"
"Speech-Language Pathology grad students provide free services to community, addressing shortage",https://news.iu.edu/southbend/live/news/43702-speech-language-pathology-grad-students-provide-free-s,"Tue, 04 Feb 2025 05:00:00 -0500"
Q&A with Auxiliary Services leader,https://today.iu.edu/iu-indianapolis/live/news/43418-qampa-with-auxiliary-services-leader,"Tue, 04 Feb 2025 05:00:00 -0500"
Celebrating Black History Month at IU,https://diversity.iu.edu/news-events/news/2025/2025-iu-black-history-month.html,"Tue, 04 Feb 2025 05:00:00 -0500"
"Faculty, staff, honored for service to campus",https://news.iu.edu/kokomo/live/news/43701-faculty-staff-honored-for-service-to-campus,"Tue, 04 Feb 2025 05:00:00 -0500"
Ambassador Shields to share foreign policy experience during week-long engagement,https://news.iu.edu/hamiltonlugar/live/news/43706-ambassador-shields-to-share-foreign-policy,"Tue, 04 Feb 2025 05:00:00 -0500"
"Faculty Innovators: Sumreen Asim, School of Education; Melanie Hughes, IU Southeast Library",https://news.iu.edu/southeast/live/news/43621-faculty-innovators-sumreen-asim-school-of,"Mon, 03 Feb 2025 05:00:00 -0500"
Staff Merit Awards recipients named,https://today.iu.edu/iub/live/news/43610-staff-merit-awards-recipients-named,"Mon, 03 Feb 2025 05:00:00 -0500"
February Photo Caption Contest,https://today.iu.edu/iu-indianapolis/live/news/43609-february-photo-caption-contest,"Mon, 03 Feb 2025 05:00:00 -0500"
HLS students form government to multiply involvement opportunities,https://news.iu.edu/hamiltonlugar/live/news/43505-hls-students-form-government-to-multiply,"Mon, 03 Feb 2025 05:00:00 -0500"
Bring wellness to your class this spring,https://today.iu.edu/iu-indianapolis/live/news/43223-bring-wellness-to-your-class-this-spring,"Mon, 03 Feb 2025 05:00:00 -0500"
"IU College of Arts and Sciences senior Cate Jensen finds purpose, path to public service",https://news.iu.edu/college/live/news/43613-iu-college-of-arts-and-sciences-senior-cate-jensen,"Mon, 03 Feb 2025 05:00:00 -0500"
"Saturn, Jupiter, and Mars possible highlights of Observatory open house",https://news.iu.edu/kokomo/live/news/43620-saturn-jupiter-and-mars-possible-highlights-of,"Mon, 03 Feb 2025 05:00:00 -0500"
"Graduate School ombudsperson hired to resolve conflicts, connect people to resources",https://news.iu.edu/live/news/43478-graduate-school-ombudsperson-hired-to-resolve,"Fri, 31 Jan 2025 05:00:00 -0500"
IU Ethics Bowl team wins bid for Nationals,https://news.iu.edu/college/live/news/43598-iu-ethics-bowl-team-wins-bid-for-nationals,"Fri, 31 Jan 2025 05:00:00 -0500"
IU Columbus student and professor honored with Building Bridges Awards,https://news.iu.edu/columbus/live/news/43509-iu-columbus-student-and-professor-honored-with,"Fri, 31 Jan 2025 05:00:00 -0500"
Charting a prosperous path to Indiana’s future with insights from IU economists,https://news.iu.edu/live/news/43595-charting-a-prosperous-path-to-indianas-future-with,"Fri, 31 Jan 2025 05:00:00 -0500"
"IUK graduate student, Carver Center, recognized with Building Bridges awards",https://news.iu.edu/kokomo/live/news/43602-iuk-graduate-student-carver-center-recognized-with,"Fri, 31 Jan 2025 05:00:00 -0500"
"Graduate School ombudsperson hired to resolve conflicts, connect people to resources",https://news.iu.edu/live/news/43478-graduate-school-ombudsperson-hired-to-resolve,"Fri, 31 Jan 2025 05:00:00 -0500"
Research Impact: IU CREATE director spearheads research of microelectronics for harsh environments,https://news.iu.edu/live/news/43548-research-impact-iu-create-director-spearheads,"Fri, 31 Jan 2025 05:00:00 -0500"
IU Southeast research center builds better futures for southern Indiana communities,https://news.iu.edu/live/news/43553-iu-southeast-research-center-builds-better-futures,"Thu, 30 Jan 2025 05:00:00 -0500"
Student body president plans career in human rights advocacy,https://news.iu.edu/kokomo/live/news/43567-student-body-president-plans-career-in-human,"Thu, 30 Jan 2025 05:00:00 -0500"
Serving the Community on MLK Day: A Student’s Perspective,https://news.iu.edu/southeast/live/news/43555-serving-the-community-on-mlk-day-a-students,"Thu, 30 Jan 2025 05:00:00 -0500"
IU South Bend’s Center for Innovation and Entrepreneurship taking shape; already offering certificate program,https://news.iu.edu/southbend/live/news/43556-iu-south-bends-center-for-innovation-and,"Thu, 30 Jan 2025 05:00:00 -0500"
IU Social Work Alum Testifies at the Indiana Statehouse,https://news.iu.edu/socialwork/live/news/43576-iu-social-work-alum-testifies-at-the-indiana-statehous,"Thu, 30 Jan 2025 05:00:00 -0500"
Discounted registration rates offered for Indy Mini,https://today.iu.edu/live/news/43512-discounted-registration-rates-offered-for-indy-mini,"Wed, 29 Jan 2025 05:00:00 -0500"
Theranos whistleblower to keynote Women & Technology Summit,https://womenandtech.indiana.edu/about/news/2025/2025-01-13-summit-headlines.html,"Wed, 29 Jan 2025 05:00:00 -0500"
"Hamilton on Foreign Policy #262: Our democracy isn’t perfect, but we can improve it",https://news.iu.edu/hamiltonlugar/live/news/43449-hamilton-on-foreign-policy-262-our-democracy-isnt,"Wed, 29 Jan 2025 05:00:00 -0500"
Associate vice president for research compliance named,https://today.iu.edu/live/news/43474-associate-vice-president-for-research-compliance,"Wed, 29 Jan 2025 05:00:00 -0500"
Dr. Lisa Hoffman appointed IU Southeast Associate Vice Chancellor for Enrollment Services & School Partnerships,https://news.iu.edu/southeast/live/news/43518-dr-lisa-hoffman-appointed-iu-southeast-associate,"Wed, 29 Jan 2025 05:00:00 -0500"
"IU study unlocks how Velvet Ant venom, while excruciating, may help advance pain-related medical research",https://news.iu.edu/college/live/news/43540-iu-study-unlocks-how-velvet-ant-venom-while,"Wed, 29 Jan 2025 05:00:00 -0500"
IU East announces Dean’s List for Fall 2024,https://news.iu.edu/east/live/news/43541-iu-east-announces-deans-list-for-fall-2024,"Wed, 29 Jan 2025 05:00:00 -0500"
High uric acid levels linked to deadly outcomes in children with severe malaria,https://medicine.iu.edu/news/2025/01/high-uric-acid-levels-deadly-children-malaria,"Wed, 29 Jan 2025 05:00:00 -0500"
"IU supports mental well-being in collaboration with Lilly Endowment, rural congregations",https://rural.indiana.edu/news/articles/2025/01-29-lilly-rural-congregations.html,"Wed, 29 Jan 2025 05:00:00 -0500"
Velvet ant venom may yield answers for pain-related medical research,https://news.iu.edu/college/live/news/43540-iu-study-unlocks-how-velvet-ant-venom-while,"Wed, 29 Jan 2025 05:00:00 -0500"
IU East announces Chancellor’s List for Fall 2024,https://news.iu.edu/east/live/news/43542-iu-east-announces-chancellors-list-for-fall-2024,"Wed, 29 Jan 2025 05:00:00 -0500"
"Celebrate Black History Month with film screenings, talent show, knowledge bowl, more",https://news.iu.edu/northwest/live/news/43508-celebrate-black-history-month-with-film-screenings,"Tue, 28 Jan 2025 05:00:00 -0500"
IU to use new AI-based tool to create better student transcript experience,https://today.iu.edu/live/news/43503-iu-to-use-new-ai-based-tool-to-create-better,"Tue, 28 Jan 2025 05:00:00 -0500"
Engage Bloomington: Provost Updates,https://provost.indiana.edu/news/2025/01-28-provost-column.html,"Tue, 28 Jan 2025 05:00:00 -0500"
Damontae Thompson brings his A-game to IU Columbus as college basketball scholar-athlete,https://news.iu.edu/columbus/live/news/43462-damontae-thompson-brings-his-a-game-to-iu-columbus,"Tue, 28 Jan 2025 05:00:00 -0500"
Student success work team enhances academic advising systems,https://undergraduate.indianapolis.iu.edu/news/2025-01-10-sdss-academic-advising-work-team-launches-with-success.html,"Tue, 28 Jan 2025 05:00:00 -0500"
African Studies Program’s Tavy Aherne receives IU Bloomington 2024 Staff Merit Award,https://news.iu.edu/hamiltonlugar/live/news/43506-african-studies-programs-tavy-aherne-receives-iu-bloom,"Mon, 27 Jan 2025 05:00:00 -0500"
"IU College of Arts and Sciences senior finds passion, path to policy work in Capitol Hill and beyond",https://news.iu.edu/college/live/news/43491-iu-college-of-arts-and-sciences-senior-finds,"Mon, 27 Jan 2025 05:00:00 -0500"
Research Impact: IU faculty’s research and creative activity help make sense of world around us,https://news.iu.edu/feature/-research-impact,"Mon, 27 Jan 2025 05:00:00 -0500"
IU Columbus introduces first signature event series with Glow Golf,https://news.iu.edu/columbus/live/news/43488-iu-columbus-introduces-first-signature-event,"Mon, 27 Jan 2025 05:00:00 -0500"
"Snow angels: Behind-the-scenes IU employees pivotal in clearing roads, pathways",https://news.iu.edu/live/news/43482-snow-angels-behind-the-scenes-iu-employees-pivotal,"Mon, 27 Jan 2025 05:00:00 -0500"
Taking a new approach to student engagement,https://news.iu.edu/northwest/live/news/43480-student-engagement-on-regional-campus,"Mon, 27 Jan 2025 05:00:00 -0500"
"Snow angels: Behind-the-scenes IU employees pivotal in clearing roads, pathways",https://news.iu.edu/live/news/43482-snow-angels-behind-the-scenes-iu-employees-pivotal,"Mon, 27 Jan 2025 05:00:00 -0500"
3 ways Microsoft Teams makes communicating easier,https://news.iu.edu/it/live/news/43504-3-ways-microsoft-teams-makes-communicating-easier,"Mon, 27 Jan 2025 05:00:00 -0500"
HLS alumni Parker Henry and Brian Fitzgerald among College 20 Under 40: 2024,https://news.iu.edu/hamiltonlugar/live/news/43481-hls-alumni-parker-henry-and-brian-fitzgerald-among-col,"Fri, 24 Jan 2025 05:00:00 -0500"
Student work to be featured in new Gallery exhibition,https://news.iu.edu/kokomo/live/news/43477-student-work-to-be-featured-in-new-gallery,"Fri, 24 Jan 2025 05:00:00 -0500"
Honoring a beautiful life: The Mary Lou Kraus Jacobi Memorial Scholarship,https://news.iu.edu/southeast/live/news/43476-honoring-a-beautiful-life-the-mary-lou-kraus,"Fri, 24 Jan 2025 05:00:00 -0500"
"Record number of students join immersion trip, get insight into Louisville’s civil rights legacy",https://news.iu.edu/columbus/live/news/43463-record-number-of-students-join-immersion-trip-get,"Fri, 24 Jan 2025 05:00:00 -0500"
IU search and rescue course teaches skills that could save lives,https://news.iu.edu/live/news/43468-iu-search-and-rescue-course-teaches-skills-that,"Fri, 24 Jan 2025 05:00:00 -0500"
IU Columbus honors two with Building Community Awards,https://news.iu.edu/columbus/live/news/43475-iu-columbus-honors-two-with-building-community,"Fri, 24 Jan 2025 05:00:00 -0500"
3 Questions: What the laws of physics tell us about CO2 removal,https://news.mit.edu/2025/3-questions-what-laws-physics-tell-us-about-co2-removal-0206,"Thu, 06 Feb 2025 00:00:00 -0500"
Seeking climate connections among the oceans’ smallest organisms,https://news.mit.edu/2025/andrew-babbin-seeks-climate-connections-among-oceans-smallest-organisms-0206,"Thu, 06 Feb 2025 00:00:00 -0500"
"David McGee named head of the Department of Earth, Atmospheric and Planetary Sciences",https://news.mit.edu/2025/david-mcgee-named-head-department-earth-atmospheric-planetary-sciences-0205,"Wed, 05 Feb 2025 16:15:00 -0500"
Study in India shows kids use different math skills at work vs. school,https://news.mit.edu/2025/study-shows-kids-use-different-math-skills-work-vs-school-0205,"Wed, 05 Feb 2025 11:00:00 -0500"
Physicists measure a key aspect of superconductivity in “magic-angle” graphene,https://news.mit.edu/2025/physicists-measure-key-aspect-superconductivity-magic-angle-graphene-0205,"Wed, 05 Feb 2025 11:00:00 -0500"
"Timeless virtues, new technologies",https://news.mit.edu/2025/timeless-virtues-new-technologies-david-mindell-book-0205,"Wed, 05 Feb 2025 00:00:00 -0500"
"Driving innovation, from Silicon Valley to Detroit",https://news.mit.edu/2025/driving-innovation-silicon-valley-detroit-doug-field-0204,"Tue, 04 Feb 2025 16:50:00 -0500"
How telecommunications cables can image the ground beneath us,https://news.mit.edu/2025/how-telecommunications-cables-can-image-ground-beneath-us-0204,"Tue, 04 Feb 2025 16:25:00 -0500"
Mishael Quraishi named 2025 Churchill Scholar,https://news.mit.edu/2025/mishael-quraishi-named-churchill-scholar-0204,"Tue, 04 Feb 2025 15:40:00 -0500"
Aligning AI with human values,https://news.mit.edu/2025/audrey-lorvo-aligning-ai-human-values-0204,"Tue, 04 Feb 2025 00:00:00 -0500"
Eleven MIT faculty receive Presidential Early Career Awards,https://news.mit.edu/2025/mit-faculty-receive-presidential-early-career-awards-0203,"Mon, 03 Feb 2025 17:00:00 -0500"
Introducing the MIT Generative AI Impact Consortium,https://news.mit.edu/2025/introducing-mit-generative-ai-impact-consortium-0203,"Mon, 03 Feb 2025 13:55:00 -0500"
"David Darmofal SM ’91, PhD ’93 named vice chancellor for undergraduate and graduate education",https://news.mit.edu/2025/david-darmofal-named-vice-chancellor-undergraduate-graduate-education-0203,"Mon, 03 Feb 2025 11:55:00 -0500"
User-friendly system can help developers build more efficient simulations and AI models,https://news.mit.edu/2025/user-friendly-system-can-help-developers-build-more-efficient-simulations-and-ai-models-0203,"Mon, 03 Feb 2025 00:00:00 -0500"
"With generative AI, MIT chemists quickly calculate 3D genomic structures",https://news.mit.edu/2025/with-generative-ai-mit-chemists-quickly-calculate-3d-genomic-structures-0131,"Fri, 31 Jan 2025 14:00:00 -0500"
MIT engineers help multirobot systems stay in the safety zone,https://news.mit.edu/2025/mit-engineers-help-multirobot-systems-stay-safety-zone-0131,"Fri, 31 Jan 2025 00:00:00 -0500"
"From bench to bedside, and beyond",https://news.mit.edu/2025/bench-bedside-and-beyond-matthew-dolan-0130,"Thu, 30 Jan 2025 16:00:00 -0500"
MIT spinout Gradiant reduces companies’ water use and waste by billions of gallons each day,https://news.mit.edu/2025/mit-spinout-gradiant-reduces-water-use-and-waste-0130,"Thu, 30 Jan 2025 00:00:00 -0500"
Rare and mysterious cosmic explosion: Gamma-ray burst or jetted tidal disruption event?,https://news.mit.edu/2025/rare-mysterious-cosmic-explosion-0129,"Wed, 29 Jan 2025 17:00:00 -0500"
Evelina Fedorenko receives Troland Award from National Academy of Sciences,https://news.mit.edu/2025/evelina-fedorenko-receives-troland-award-0129,"Wed, 29 Jan 2025 16:25:00 -0500"
3 Questions: Modeling adversarial intelligence to exploit AI’s security vulnerabilities,https://news.mit.edu/2025/3-questions-una-may-o-reilly-modeling-adversarial-intelligence-0129,"Wed, 29 Jan 2025 16:00:00 -0500"
MIT students' works redefine human-AI collaboration,https://news.mit.edu/2025/mit-students-works-redefine-human-ai-collaboration-0129,"Wed, 29 Jan 2025 15:45:00 -0500"
Smart carbon dioxide removal yields economic and environmental benefits,https://news.mit.edu/2025/smart-carbon-dioxide-removal-yields-economic-environmental-benefits-0129,"Wed, 29 Jan 2025 14:15:00 -0500"
New training approach could help AI agents perform better in uncertain conditions,https://news.mit.edu/2025/new-training-approach-could-help-ai-perform-better-0129,"Wed, 29 Jan 2025 00:00:00 -0500"
MIT Climate and Energy Ventures class spins out entrepreneurs — and successful companies,https://news.mit.edu/2025/mit-climate-and-energy-ventures-class-0128,"Tue, 28 Jan 2025 00:00:00 -0500"
Expanding robot perception,https://news.mit.edu/2025/expanding-robot-perception-luca-carlone-0128,"Tue, 28 Jan 2025 00:00:00 -0500"
MIT Press’ Direct to Open opens access to over 80 new monographs,https://news.mit.edu/2025/mit-press-direct-to-open-opens-access-over-80-new-monographs-0127,"Mon, 27 Jan 2025 16:55:00 -0500"
Faces of MIT: Melissa Smith PhD ’12,https://news.mit.edu/2025/faces-of-mit-melissa-smith-0127,"Mon, 27 Jan 2025 16:45:00 -0500"
"Professor Emeritus Gerald Schneider, discoverer of the “two visual systems,” dies at 84",https://news.mit.edu/2025/professor-emeritus-gerald-schneider-dies-0127,"Mon, 27 Jan 2025 16:30:00 -0500"
Kingdoms collide as bacteria and cells form captivating connections,https://news.mit.edu/2025/kingdoms-collide-bacteria-cells-form-captivating-connections-0124,"Fri, 24 Jan 2025 15:00:00 -0500"
Is this the new playbook for curing rare childhood diseases?,https://news.mit.edu/2025/new-playbook-curing-rare-childhood-diseases-0124,"Fri, 24 Jan 2025 15:00:00 -0500"
How good old mud can lower building costs,https://news.mit.edu/2025/how-good-old-mud-can-lower-building-costs-0124,"Fri, 24 Jan 2025 00:00:00 -0500"
Building resiliency,https://news.mit.edu/2025/how-cities-are-weathering-climate-crisis-lawrence-vale-book-0124,"Fri, 24 Jan 2025 00:00:00 -0500"
A platform to expedite clean energy projects,https://news.mit.edu/2025/station-a-expedites-clean-energy-projects-0124,"Fri, 24 Jan 2025 00:00:00 -0500"
Mayo Clinic Minute: What to do for a healthier heart,https://newsnetwork.mayoclinic.org/?p=380638,"Tuesday, February 4, 2025"
World Cancer Day 2025: People with cancer are 'united by unique',https://newsnetwork.mayoclinic.org/?p=399534,"Tuesday, February 4, 2025"
Mayo Clinic Q and A: What to eat for a healthy heart,https://newsnetwork.mayoclinic.org/?p=396857,"Monday, February 3, 2025"
Mayo Clinic Minute: Alcohol and cancer risk,https://newsnetwork.mayoclinic.org/?p=399108,"Monday, February 3, 2025"
Mayo Clinic hospitals named among America's Best Hospitals by Healthgrades,https://newsnetwork.mayoclinic.org/?p=399496,"Friday, January 31, 2025"
In case you missed it: This week's Top 5 stories on social media,https://newsnetwork.mayoclinic.org/?p=399469,"Friday, January 31, 2025"
Mayo Clinic Minute: How alcohol affects your liver,https://newsnetwork.mayoclinic.org/?p=398807,"Thursday, January 30, 2025"
Mayo Clinic Q and A: Clot buster? Surgery? What is the right treatment for stroke?,https://newsnetwork.mayoclinic.org/?p=397506,"Wednesday, January 29, 2025"
Tomorrow's Cure: Predicting disease risk with polygenic risk scores,https://newsnetwork.mayoclinic.org/?p=399174,"Wednesday, January 29, 2025"
Student's research aims to uncover new biomarkers for Krabbe disease,https://newsnetwork.mayoclinic.org/?p=399443,"Tuesday, January 28, 2025"
Mayo Clinic opens new doors in cancer treatment innovation,https://newsnetwork.mayoclinic.org/?p=399315,"Tuesday, January 28, 2025"
Mayo Clinic and American Hospital Dubai Strengthen Collaboration to Transform Healthcare and Medical Education in Dubai,https://newsnetwork.mayoclinic.org/?p=399398,"Tuesday, January 28, 2025"
"Mayo Clinic Minute: Dual procedure combines liver transplant, bariatric surgery",https://newsnetwork.mayoclinic.org/?p=398817,"Monday, January 27, 2025"
(VIDEO) What you need to know about HMPV,https://newsnetwork.mayoclinic.org/?p=399103,"Friday, January 24, 2025"
