Title,Link,Publication Date
Princeton's Wintersession marks five years of curiosity-driven learning,https://www.princeton.edu/news/2025/01/29/princetons-wintersession-marks-five-years-curiosity-driven-learning,"Wed, 29 Jan 2025 17:31:00 -0500"
"President Eisgruber's State of the University Letter, 2025",https://www.princeton.edu/news/2025/01/29/president-eisgrubers-state-university-letter-2025,"Wed, 29 Jan 2025 15:33:00 -0500"
Jenny Greene wins presidential mentoring award for Prison Teaching Initiative,https://www.princeton.edu/news/2025/01/24/jenny-greene-wins-presidential-mentoring-award-prison-teaching-initiative,"Fri, 24 Jan 2025 11:23:24 -0500"
Envision Center to host Collab XR Demo Series,https://www.rcac.purdue.edu/news/7047,"Thu, 06 Feb 2025 10:42:21 -0500"
Purdue to host MATLAB Parallel Computing Workshop,https://www.rcac.purdue.edu/news/7041,"Mon, 03 Feb 2025 13:56:36 -0500"
"RCAC uses liquid cooling to provide computational science at scale, offer best in class value to researchers",https://www.rcac.purdue.edu/news/6967,"Fri, 24 Jan 2025 00:00:00 -0500"
Texas A&M System Goes Nuclear,https://news.tamus.edu/texas-am-system-goes-nuclear/,"Tue, 04 Feb 2025 16:00:00 +0000"
THON leaders and Four Diamonds representatives showcase impact at state capitol,https://www.psu.edu/news/campus-life/story/thon-leaders-and-four-diamonds-representatives-showcase-impact-state-capitol,"Thu, 06 Feb 2025 09:35:53 -0500"
"University Park classes, activities and work canceled until noon Thursday",https://www.psu.edu/news/campus-life/story/university-park-classes-activities-and-work-canceled-until-noon-thursday,"Wed, 05 Feb 2025 17:44:08 -0500"
The Medical Minute: Can you have a heart attack and not know it?,https://www.psu.edu/news/hershey/story/medical-minute-can-you-have-heart-attack-and-not-know-it,"Wed, 05 Feb 2025 15:56:10 -0500"
Could an Earth-like alien civilization detect us?,https://www.psu.edu/news/eberly-college-science/story/could-earth-alien-civilization-detect-us,"Wed, 05 Feb 2025 15:10:04 -0500"
Heard on Campus: Lukas Muechler on quantum materials,https://www.psu.edu/news/eberly-college-science/story/heard-campus-lukas-muechler-quantum-materials,"Wed, 05 Feb 2025 15:09:41 -0500"
Penn State students urged to consider mental health impacts of sports betting,https://www.psu.edu/news/student-affairs/story/penn-state-students-urged-consider-mental-health-impacts-sports-betting,"Wed, 05 Feb 2025 15:00:00 -0500"
Understanding aging requires more than counting birthdays,https://www.psu.edu/news/health-and-human-development/story/understanding-aging-requires-more-counting-birthdays,"Wed, 05 Feb 2025 13:34:51 -0500"
Penn State Harrisburg announces the Pennsylvania Center for Latino Research,https://www.psu.edu/news/harrisburg/story/penn-state-harrisburg-announces-pennsylvania-center-latino-research,"Wed, 05 Feb 2025 13:00:00 -0500"
Feb. 12 EEEPI seminar: Effect of policies on groundwater resources in India,https://www.psu.edu/news/earth-and-mineral-sciences/story/feb-12-eeepi-seminar-effect-policies-groundwater-resources-india,"Wed, 05 Feb 2025 12:18:34 -0500"
Chemical engineering professor awarded Polymer Physics Prize,https://www.psu.edu/news/engineering/story/chemical-engineering-professor-awarded-polymer-physics-prize,"Wed, 05 Feb 2025 12:12:32 -0500"
Nittany Valley Symphony to host free concert Feb. 24 in Eisenhower Auditorium,https://www.psu.edu/news/arts-and-entertainment/story/nittany-valley-symphony-host-free-concert-feb-24-eisenhower-auditorium,"Wed, 05 Feb 2025 11:36:36 -0500"
Porous plastic sheets can cool buildings by radiating light to space,https://www.psu.edu/news/engineering/story/porous-plastic-sheets-can-cool-buildings-radiating-light-space,"Wed, 05 Feb 2025 11:07:32 -0500"
"Fool yourself: People unknowingly cheat on tasks to feel smarter, healthier",https://www.psu.edu/news/research/story/fool-yourself-people-unknowingly-cheat-tasks-feel-smarter-healthier,"Wed, 05 Feb 2025 10:05:33 -0500"
Gov. Shapiro proposes $60M in new funding for state-related universities,https://www.psu.edu/news/story/gov-shapiro-proposes-60m-new-funding-state-related-universities,"Tue, 04 Feb 2025 16:00:00 -0500"
Fossils show leaf-eating insects tracked gum trees for millions of years,https://www.psu.edu/news/earth-and-mineral-sciences/story/fossils-show-leaf-eating-insects-tracked-gum-trees-millions-years,"Tue, 04 Feb 2025 14:06:33 -0500"
"Inuit leaders to discuss climate-changed Arctic in panel, movie premiere",https://www.psu.edu/news/penn-state-climate-consortium/story/inuit-leaders-discuss-climate-changed-arctic-panel-movie,"Tue, 04 Feb 2025 12:34:56 -0500"
UAB to host Alabama State Spelling Bee on March 22,https://www.uab.edu/news/arts/item/14544-uab-to-host-alabama-state-spelling-bee-on-march-22,"Wed, 05 Feb 2025 12:46:58 -0600"
Walking time bomb: 43-year-old man’s life saved with open heart surgery at UAB St. Vincent’s,https://www.uab.edu/news/health/item/14541-walking-time-bomb-43-year-old-man-s-life-saved-with-open-heart-surgery-at-uab-st-vincent-s,"Wed, 05 Feb 2025 09:00:00 -0600"
Mohammad Firouz,https://www.uab.edu/news/experts/all-experts-category/item/14540-firouz-mohammad,"Fri, 31 Jan 2025 10:53:23 -0600"
The Chicago Principles at Ten Years: President Alivisatos’ keynote address,https://news.uchicago.edu/story/chicago-principles-ten-years-president-alivisatos-keynote-address,02/06/2025 - 01:42pm
UChicago event examines impact and future of Chicago Principles on 10th anniversary,https://news.uchicago.edu/story/uchicago-event-examines-impact-and-future-chicago-principles-10th-anniversary,02/06/2025 - 01:05pm
‘A Raisin in the Sun’ comes home to the South Side at UChicago’s Court Theatre,https://news.uchicago.edu/story/raisin-sun-comes-home-south-side-uchicagos-court-theatre,02/04/2025 - 02:03pm
Ruby Bridges urges people to ‘choose good’ in the fight against injustice,https://news.uchicago.edu/story/ruby-bridges-urges-people-choose-good-fight-against-injustice,02/04/2025 - 10:50am
Dr. King’s words resonate across UChicago during daylong readings,https://news.uchicago.edu/story/dr-kings-words-resonate-across-uchicago-during-daylong-readings,02/04/2025 - 10:45am
Lunar rocks help scientists pinpoint when the moon crystallized,https://news.uchicago.edu/story/lunar-rocks-help-scientists-pinpoint-when-moon-crystallized,02/03/2025 - 10:06am
How to celebrate Black History Month 2025 at UChicago,https://news.uchicago.edu/story/how-celebrate-black-history-month-2025-uchicago,02/03/2025 - 09:45am
Scientists explore how to make quantum bits with spinel gemstones,https://news.uchicago.edu/story/scientists-explore-how-make-quantum-bits-spinel-gemstones,01/31/2025 - 01:30pm
What effect will Trump’s tariffs have on the U.S. economy?,https://news.uchicago.edu/story/what-effect-will-trumps-tariffs-have-us-economy,01/31/2025 - 12:46pm
What can you do to prevent getting bird flu?,https://news.uchicago.edu/story/what-can-you-do-prevent-getting-bird-flu,01/30/2025 - 11:14am
"Thomas ‘Tom’ Mapp, visionary arts educator and administrator at UChicago, 1936‒2024",https://news.uchicago.edu/story/thomas-tom-mapp-visionary-arts-educator-and-administrator-uchicago-1936-2024,01/29/2025 - 09:43am
UChicago News launches redesigned website,https://news.uchicago.edu/story/uchicago-news-launches-redesigned-website,01/28/2025 - 10:25pm
Making prosthetic limbs feel more real with brain-computer interfaces,https://news.uchicago.edu/story/making-prosthetic-limbs-feel-more-real-brain-computer-interfaces,01/28/2025 - 03:25pm
Doomsday Clock moves closest ever to apocalypse—at 89 seconds to midnight,https://news.uchicago.edu/story/doomsday-clock-moves-closest-ever-apocalypse-89-seconds-midnight,01/28/2025 - 11:33am
"Collaboration to provide up to $130 million to fuel drug discovery, development at UChicago",https://news.uchicago.edu/story/collaboration-provide-130-million-fuel-drug-discovery-development-uchicago,01/28/2025 - 10:59am
"As International Year of Quantum begins, read about the latest breakthroughs",https://news.uchicago.edu/story/international-year-quantum-begins-read-about-latest-breakthroughs,01/24/2025 - 10:43am
UChicago scientists reveal nervous system secrets that give octopus arms their incredible dexterity,https://news.uchicago.edu/story/uchicago-scientists-reveal-nervous-system-secrets-give-octopus-arms-their-incredible,01/23/2025 - 10:28am
Exhibitions on Pan-Africanism highlight Neubauer Collegium’s decade of human-centered research,https://news.uchicago.edu/story/exhibitions-pan-africanism-highlight-neubauer-collegiums-decade-human-centered-research,01/21/2025 - 11:55am
How do you prevent and treat norovirus?,https://news.uchicago.edu/story/how-do-you-prevent-and-treat-norovirus,01/21/2025 - 09:30am
"Economic inequality leads to democratic erosion, study finds",https://news.uchicago.edu/story/economic-inequality-leads-democratic-erosion-study-finds,01/17/2025 - 11:31am
Chicago Principles at 10: Event to reflect on free expression at UChicago and beyond,https://news.uchicago.edu/story/chicago-principles-10-event-reflect-free-expression-uchicago-and-beyond,01/15/2025 - 03:22pm
"UChicago undergraduate, alum named 2025-26 Schwarzman Scholars",https://news.uchicago.edu/story/uchicago-undergraduate-alum-named-2025-26-schwarzman-scholars,01/14/2025 - 02:42pm
Climate change may help invasive species defoliate forests,https://news.uchicago.edu/story/climate-change-may-help-invasive-species-defoliate-forests,01/14/2025 - 10:46am
"Stuart A. Rice, UChicago professor who shaped the field of physical chemistry, 1932-2024",https://news.uchicago.edu/story/stuart-rice-uchicago-professor-who-shaped-field-physical-chemistry-1932-2024,01/13/2025 - 04:49pm
Ruby Bridges to speak at UChicago’s 2025 MLK commemoration,https://news.uchicago.edu/story/ruby-bridges-speak-uchicagos-2025-mlk-commemoration,01/13/2025 - 11:54am
K-State veterinarian warns cat owners about H5N1 risks amid rising cases,https://www.k-state.edu/media/newsreleases/2025-02/KState-veterinarian-warns-cat-owners-about-H5N1-risks.html,"Wed, 05 Feb 2025 +0000"
K-State engineers developing in-track measurement for railroad steel stress,https://www.k-state.edu/media/newsreleases/2025-02/KState-engineers-developing-new-railroad-technology.html,"Wed, 05 Feb 2025 +0000"
The Peking Acrobats tumble into McCain Auditorium,http://k-state.edu/media/newsreleases/2025-02/McCain-Performance-Series-presents-The-Peking-Acrobats.html,"Mon, 03 Feb 2025 +0000"
K-State online degrees recognized among best in the nation,https://www.k-state.edu/media/newsreleases/2025-01/kstate-online-programs-ranked-highly-for-accessibility-and-quality,"Fri, 31 Jan 2025 +0000"
"Phillips 66 Business Ethics Case Competition awards $8,400 to K-State students",https://www.k-state.edu/media/newsreleases/2025-01/KState-students-earn-scholarships-at-Phillips-66-Case-competition.html,"Fri, 31 Jan 2025 +0000"
K-State offers program for middle and high school students to learn about careers in helping professions,https://www.k-state.edu/media/newsreleases/2025-01/Social-Impact-Lab-for-high-school-and-middle-school-students-teaches-about-helping-professions.html,"Fri, 31 Jan 2025 +0000"
"American Heart Association Taps Nursing Dean, Assistant Professor for Women of Impact Campaign",https://news.uthsc.edu/american-heart-association-taps-nursing-dean-assistant-professor-for-women-of-impact-campaign/,"Thu, 06 Feb 2025 19:00:00 +0000"
"Inaugural Year for Staff Senate a Success, Looking to the Future",https://news.uthsc.edu/inaugural-year-for-staff-senate-a-success-looking-to-the-future/,"Wed, 05 Feb 2025 22:00:00 +0000"
"National Eye Institute Awards $423,500 for Innovative Eye Disease Research Using AI",https://news.uthsc.edu/national-eye-institute-awards-423500-for-innovative-eye-disease-research-using-ai/,"Wed, 05 Feb 2025 16:00:00 +0000"
"Bhupesh Singla, PhD, Secures $2.8 Million NIH Grant to Study Mechanisms of Atherosclerosis",https://news.uthsc.edu/bhupesh-singla-phd-secures-2-8-million-nih-grant-to-study-mechanisms-of-atherosclerosis/,"Tue, 04 Feb 2025 17:33:34 +0000"
Advisory Board to Hold Winter Meeting February 7,https://news.uthsc.edu/advisory-board-to-hold-winter-meeting-february-7/,"Fri, 31 Jan 2025 15:30:00 +0000"
Institutional Research Cores Have Record Accomplishments in FY2024,https://news.uthsc.edu/institutional-research-cores-have-record-accomplishments-in-fy2024/,"Thu, 30 Jan 2025 16:06:20 +0000"
Nursing Students Find Value in Operating Room Scholars Program,https://news.uthsc.edu/nursing-students-find-value-in-operating-room-scholars-program/,"Wed, 29 Jan 2025 20:00:00 +0000"
Chancellor Peter Buckley Privileged to Be Recognized Among Memphis’ Business Leaders,https://news.uthsc.edu/chancellor-peter-buckley-privileged-to-be-recognized-among-memphis-business-leaders/,"Fri, 24 Jan 2025 16:00:00 +0000"
PUBLIC NOTICE: UT Health Science Center Releases Proposed Tuition and Mandatory Fee Increases,https://news.tennessee.edu/?p=3240,No Date
Auto Draft,https://news.tennessee.edu/?p=3239,No Date
https://news.tennessee.edu/2025/01/30/ut-system-president-to-deliver-2025-state-of-the-university-address/,https://news.tennessee.edu/amp_validated_url/e5f1c6b459b1560dc419665cfd042c4e/,"Thu, 30 Jan 2025 22:23:11 +0000"
UT System President to Deliver 2025 State of the University Address,https://news.tennessee.edu/2025/01/30/ut-system-president-to-deliver-2025-state-of-the-university-address/,"Thu, 30 Jan 2025 15:00:53 +0000"
2025_SoUT_news-1200×600,https://news.tennessee.edu/2025/01/30/ut-system-president-to-deliver-2025-state-of-the-university-address/2025_sout_news-1200x600/,"Wed, 29 Jan 2025 13:51:32 +0000"
https://news.tennessee.edu/2025/01/17/public-notice-ut-board-of-trustees-executive-committee-to-meet/,https://news.tennessee.edu/amp_validated_url/82fca8b2289aea59dde7dd9cd4620db0/,"Thu, 23 Jan 2025 22:22:35 +0000"
Latina college students lost ground after the pandemic,https://news.ucr.edu/articles/2025/02/05/latina-college-students-lost-ground-after-pandemic,"Wed, 05 Feb 2025 00:00:00 -0800"
UCR alum creates endowment for students experiencing tragedy,https://news.ucr.edu/articles/2025/02/05/ucr-alum-creates-endowment-students-experiencing-tragedy,"Wed, 05 Feb 2025 00:00:00 -0800"
How is AI influencing the field of medicine?,https://news.ucr.edu/articles/2025/02/04/how-ai-influencing-field-medicine,"Tue, 04 Feb 2025 00:00:00 -0800"
Building the Library of the Future,https://news.ucr.edu/articles/2025/02/01/building-the-library-of-the-future,"Sat, 01 Feb 2025 00:00:00 -0800"
Meet the new dean of CNAS,https://news.ucr.edu/articles/2025/01/31/meet-new-dean-cnas,"Fri, 31 Jan 2025 00:00:00 -0800"
New diagnostic tool will help LIGO hunt gravitational waves,https://news.ucr.edu/articles/2025/01/30/new-diagnostic-tool-will-help-ligo-hunt-gravitational-waves,"Thu, 30 Jan 2025 00:00:00 -0800"
"Women’s pelvic tissue tears during childbirth unstudied, until now",https://news.ucr.edu/articles/2025/01/29/womens-pelvic-tissue-tears-during-childbirth-unstudied-until-now,"Wed, 29 Jan 2025 00:00:00 -0800"
Orchestra to host 'extroverted' weekend concerts,https://news.ucr.edu/articles/2025/01/29/orchestra-host-extroverted-weekend-concerts,"Wed, 29 Jan 2025 00:00:00 -0800"
Project helps preserve architectural photographs,https://news.ucr.edu/articles/2025/01/29/project-helps-preserve-architectural-photographs,"Wed, 29 Jan 2025 00:00:00 -0800"
More transparency about So Cal's fire-polluted air,https://news.ucr.edu/articles/2025/01/24/more-transparency-about-so-cals-fire-polluted-air,"Fri, 24 Jan 2025 00:00:00 -0800"
"U-M to host summit on electric, water utility resiliency",https://news.umich.edu/u-m-to-host-summit-on-electric-water-utility-resiliency/,"Thu, 06 Feb 2025 19:03:48 +0000"
Are Super Bowl cheers bad for your ears?,https://news.umich.edu/are-super-bowl-cheers-bad-for-your-ears/,"Wed, 05 Feb 2025 20:30:00 +0000"
Detroit’s economic picture expected to improve over next few years after labor market challenges,https://news.umich.edu/detroits-economic-picture-expected-to-improve-over-next-few-years-after-labor-market-challenges/,"Tue, 04 Feb 2025 13:30:00 +0000"
"Unpacking DeepSeek: Distillation, ethics and national security",https://news.umich.edu/unpacking-deepseek-distillation-ethics-and-national-security/,"Fri, 31 Jan 2025 16:13:14 +0000"
"How should we address the climate crisis? Talk about it, says climate scientist, nonprofit group",https://news.umich.edu/how-should-we-address-the-climate-crisis-talk-about-it-says-climate-scientist-nonprofit-group/,"Thu, 30 Jan 2025 19:49:37 +0000"
Rhiannon Giddens appointed inaugural U-M Artist-in-Residence,https://news.umich.edu/rhiannon-giddens-appointed-inaugural-u-m-artist-in-residence/,"Thu, 30 Jan 2025 18:46:11 +0000"
"Uber, Lyft or transit? The answer appears to align with how people value their time",https://news.umich.edu/uber-lyft-or-transit-the-answer-appears-to-align-with-how-people-value-their-time/,"Wed, 29 Jan 2025 19:04:33 +0000"
Unpaid caregivers find moments of joy in daily life,https://news.umich.edu/unpaid-caregivers-find-moments-of-joy-in-daily-life/,"Wed, 29 Jan 2025 17:39:51 +0000"
Finding the most efficient carbon-neutral aircraft for your flight,https://news.umich.edu/finding-the-most-efficient-carbon-neutral-aircraft-for-your-flight/,"Wed, 29 Jan 2025 17:26:46 +0000"
Paywalls influence newspaper coverage,https://news.umich.edu/paywalls-influence-newspaper-coverage/,"Wed, 29 Jan 2025 16:15:21 +0000"
"U-M faculty examine Trump administration actions pausing loans and grants, firing prosecutors",https://news.umich.edu/u-m-faculty-examine-trump-administration-actions-pausing-loans-and-grants-firing-prosecutors/,"Tue, 28 Jan 2025 21:21:27 +0000"
U-M enters agreement on UMCI residential housing,https://news.umich.edu/u-m-enters-agreement-on-umci-residential-housing/,"Tue, 28 Jan 2025 15:40:52 +0000"
The state of the Great Lakes: U-M experts available to comment,https://news.umich.edu/the-state-of-the-great-lakes-u-m-experts-available-to-comment/,"Mon, 27 Jan 2025 17:48:04 +0000"
Consumer sentiment down amid disagreements on new government policies,https://news.umich.edu/consumer-sentiment-down-amid-disagreements-on-new-government-policies/,"Fri, 24 Jan 2025 15:24:54 +0000"
Michael Rubach gives back through 'Only in Nebraska' campaign,https://news.unl.edu/article/michael-rubach-gives-back-through-only-in-nebraska-campaign,"Thu, 06 Feb 2025 00:23:00 -0600"
Oral history project captures Niobrara’s resilience,https://news.unl.edu/article/oral-history-project-captures-niobraras-resilience,"Thu, 06 Feb 2025 00:00:00 -0600"
McDonald finds beauty in the macabre,https://news.unl.edu/article/mcdonald-finds-beauty-in-the-macabre,"Wed, 05 Feb 2025 00:26:00 -0600"
"Nebraska team shows how simple data can reduce portions, food waste",https://news.unl.edu/article/nebraska-team-shows-how-simple-data-can-reduce-portions-food-waste,"Wed, 05 Feb 2025 00:25:00 -0600"
"Kolb mentors, empowers fellow first-gen students with CAST",https://news.unl.edu/article/kolb-mentors-empowers-fellow-first-gen-students-with-cast,"Wed, 05 Feb 2025 00:23:00 -0600"
Emerging Tech Conference to feature AI expert,https://news.unl.edu/article/emerging-tech-conference-to-feature-ai-expert,"Wed, 05 Feb 2025 00:20:00 -0600"
Student support programs aid Casperson's academic success,https://news.unl.edu/article/student-support-programs-aid-caspersons-academic-success,"Tue, 04 Feb 2025 15:20:14 -0600"
Nebraska in the national news: January 2025,https://news.unl.edu/article/nebraska-in-the-national-news-january-2025,"Tue, 04 Feb 2025 00:00:00 -0600"
"7,300-plus Huskers named to Deans' List for fall 2024",https://news.unl.edu/article/7300-plus-huskers-named-to-deans-list-for-fall-2024,"Mon, 03 Feb 2025 00:25:00 -0600"
200-plus Huskers named to Deans’ Commendation List for fall 2024,https://news.unl.edu/article/200-plus-huskers-named-to-deans-commendation-list-for-fall-2024,"Mon, 03 Feb 2025 00:24:00 -0600"
Physicist Laura Fields granted a Presidential Early Career Award,https://news.nd.edu/news/physicist-laura-fields-granted-a-presidential-early-career-award/,2025-02-05T16:00:00-05:00
Notre Dame celebrates Black History Month,https://news.nd.edu/news/notre-dame-celebrates-black-history-month-3/,2025-02-05T14:35:00-05:00
University of Notre Dame and Pontificia Universidad Católica de Chile dual PhD program welcomes all disciplines,https://news.nd.edu/news/notre-dame-and-uc-chile-dual-phd-program-welcomes-all-disciplines/,2025-02-04T13:37:00-05:00
"PAM-M partners with civil society in baseline report, shedding light on Bangsamoro peace process in the Philippines",https://news.nd.edu/news/pam-m-partners-with-civil-society-in-baseline-report-shedding-light-on-bangsamoro-peace-process-in-the-philippines/,2025-02-04T13:20:00-05:00
Three Notre Dame Faculty Recognized in 2025 RHSU Edu-Scholar Public Influence Rankings,https://news.nd.edu/news/three-notre-dame-faculty-recognized-in-2025-rhsu-edu-scholar-public-influence-rankings/,2025-02-04T13:00:00-05:00
Empowering through education: A pathway out of poverty for children in India,https://news.nd.edu/news/empowering-through-education/,2025-02-03T13:25:00-05:00
"Walk the Walk Week prayer service emphasizes the power of love, call to uplift one another",https://news.nd.edu/news/walk-the-walk-week-prayer-service-emphasizes-the-power-of-love-call-to-uplift-one-another/,2025-02-03T11:17:00-05:00
Undersecretary of the Dicastery for Promoting Integral Human Development to deliver Keeley Vatican Lecture,https://news.nd.edu/news/undersecretary-of-the-dicastery-for-promoting-integral-human-development-to-deliver-keeley-vatican-lecture/,2025-02-03T09:00:00-05:00
Ahsan Kareem elected to the European Academy of Sciences and Arts,https://news.nd.edu/news/ahsan-kareem-elected-to-the-european-academy-of-sciences-and-arts/,2025-01-31T16:58:00-05:00
Liam O’Connor selected as 2025 Richard H. Driehaus Prize Laureate at the University of Notre Dame; Philippe Rotthier wins Henry Hope Reed Award,https://news.nd.edu/news/liam-oconnor-selected-as-2025-richard-h-driehaus-prize-laureate-at-the-university-of-notre-dame-philippe-rotthier-wins-henry-hope-reed-award/,2025-01-30T09:30:00-05:00
"Aspects of marriage counseling may hold the key to depolarizing, unifying the country, study finds",https://news.nd.edu/news/aspects-of-marriage-counseling-may-hold-the-key-to-depolarizing-unifying-the-country-study-finds/,2025-01-30T09:00:00-05:00
"Bots increase online user engagement but stifle meaningful discussion, study shows",https://news.nd.edu/news/bots-increase-online-user-engagement-but-stifle-meaningful-discussion-study-shows/,2025-01-29T09:00:00-05:00
Notre Dame researchers partner with Mexico hospital to develop childhood cancer care monitoring tool,https://news.nd.edu/news/notre-dame-researchers-partner-with-mexico-hospital-to-develop-childhood-cancer-care-monitoring-tool/,2025-01-27T13:09:40-05:00
Four Arts & Letters faculty continue Notre Dame’s record NEH fellowship success,https://news.nd.edu/news/four-arts-letters-faculty-continue-notre-dames-record-neh-fellowship-success/,2025-01-24T15:00:00-05:00
"Nearly 500 students, faculty and staff to attend 2025 March for Life in Washington, D.C.",https://news.nd.edu/news/nearly-500-students-faculty-and-staff-to-attend-2025-march-for-life-in-washington-d-c/,2025-01-23T15:30:00-05:00
"Nanovic Institute awards 2025 Laura Shannon Prize to Megan Brown, author of ‘The Seventh Member State’",https://news.nd.edu/news/2025-laura-shannon-prize-awarded-to-megan-browns-the-seventh-member-state/,2025-01-23T10:03:07-05:00
Notre Dame to celebrate 10th annual Walk the Walk Week,https://news.nd.edu/news/notre-dame-to-celebrate-10th-annual-walk-the-walk-week/,2025-01-22T13:30:00-05:00
"Statement on national championship game from University President Rev. Robert A. Dowd, C.S.C.",https://news.nd.edu/news/statement-on-national-championship-game-from-university-president-rev-robert-a-dowd-c-s-c/,2025-01-20T23:30:00-05:00
"A global majority trusts scientists, wants them to have greater role in policymaking, study finds",https://news.nd.edu/news/a-global-majority-trusts-scientists-wants-them-to-have-greater-role-in-policymaking-study-finds/,2025-01-20T07:14:00-05:00
Lilly Endowment grant supports expansion of Robinson Center’s Talk With Your Baby program,https://news.nd.edu/news/lilly-endowment-grant-supports-expansion-of-robinson-centers-talk-with-your-baby-program/,2025-01-16T11:00:00-05:00
Pitt professors weigh in on ‘Gulf of America’ debate,https://pittnews.com/article/194090/top-stories/pitt-professors-weigh-in-on-gulf-of-america-debate/,"Wed, 05 Feb 2025 16:08:21 +0000"
"SGB plans asynchronous classes on future election days, hears concerns from student organizations",https://pittnews.com/article/194088/uncategorized/sgb-plans-asynchronous-classes-on-future-election-days-hears-concerns-from-student-organizations/,"Wed, 05 Feb 2025 15:58:09 +0000"
More than legislation: ‘Title 9’ women’s sports bar coming to East Liberty,https://pittnews.com/article/194086/news/more-than-legislation-title-9-womens-sports-bar-coming-to-east-liberty/,"Wed, 05 Feb 2025 13:12:36 +0000"
Pittsburgh Latino organizations provide support amid new executive immigration policies,https://pittnews.com/article/194083/featured/pittsburgh-latino-organizations-provide-support-amid-new-executive-immigration-policies/,"Wed, 05 Feb 2025 13:09:11 +0000"
"Pitt men’s basketball too cavalier in loss to Virginia, leaving tournament odds up in the air",https://pittnews.com/article/194073/top-stories/pitt-mens-basketball-too-cavalier-in-loss-to-virginia-leaving-tournament-odds-up-in-the-air/,"Wed, 05 Feb 2025 05:14:14 +0000"
Review | FKA Twigs Wants to Know If You’re Feeling Eusexua,https://pittnews.com/article/194081/arts-and-entertainment/review-fka-twigs-wants-to-know-if-youre-feeling-eusexua/,"Wed, 05 Feb 2025 05:03:27 +0000"
